{
  "schemaVersion": 1,
  "id": "sql-orders-transaction-001",
  "version": 1,
  "title": "Réserver un stock sous transaction",
  "difficulty": 4,
  "skills": ["sql.transaction", "sql.isolation", "sql.atomic-update"],
  "prerequisites": ["sql-orders-cte-001"],
  "estimatedMinutes": 45,
  "image": "mcr.microsoft.com/mssql/server@sha256:ba4c8329f48fb8f02e1416be6a930ebfd71268caee78aa985f3af4315e457c89",
  "datasetPath": "dataset.sql",
  "visibleSchemaPath": "schema.sql",
  "permissions": ["select", "update"],
  "resetScriptPath": "reset.sql",
  "statementPath": "statement.md",
  "expectedResult": {
    "ordered": true,
    "columns": ["ProductId", "Quantity"],
    "numericTolerance": 0
  },
  "timeoutSeconds": 5,
  "maxRows": 5,
  "effectAssertions": [
    "La quantité vaut 3 dans la transaction puis revient à 5 après rollback",
    "Une quantité insuffisante ne peut jamais devenir négative"
  ],
  "solutionPath": "solution.md",
  "reviewCards": [
      "card-sql-orders-transaction-001-rule",
      "card-sql-orders-transaction-001-edge"
  ],
  "license": "CC-BY-4.0"
}
