{
    "schemaVersion":  1,
    "id":  "sql-customer-revenue-001",
    "version":  1,
    "title":  "Agréger le revenu client",
    "difficulty":  2,
    "skills":  [
                   "sql.aggregate"
               ],
    "prerequisites":  [

                      ],
    "estimatedMinutes":  35,
    "image":  "mcr.microsoft.com/mssql/server@sha256:ba4c8329f48fb8f02e1416be6a930ebfd71268caee78aa985f3af4315e457c89",
    "datasetPath":  "dataset.sql",
    "visibleSchemaPath":  "schema.sql",
    "permissions":  [
                        "select"
                    ],
    "resetScriptPath":  "reset.sql",
    "statementPath":  "statement.md",
    "expectedResult":  {
                           "ordered":  true,
                           "columns":  [
                                           "CustomerId",
                                           "Revenue"
                                       ],
                           "numericTolerance":  0.01
                       },
    "timeoutSeconds":  5,
    "maxRows":  20,
    "effectAssertions":  [
                             "Les quatre clients, cinq commandes et six lignes restent inchangés après rollback"
                         ],
    "solutionPath":  "solution.md",
    "license":  "CC-BY-4.0"
}
