{
  "schemaVersion": 1,
  "id": "sql-orders-join-001",
  "version": 1,
  "title": "Joindre clients actifs et commandes ouvertes",
  "difficulty": 2,
  "skills": ["sql.relational-model", "sql.filter", "sql.join"],
  "prerequisites": [],
  "estimatedMinutes": 35,
  "image": "mcr.microsoft.com/mssql/server@sha256:ba4c8329f48fb8f02e1416be6a930ebfd71268caee78aa985f3af4315e457c89",
  "datasetPath": "dataset.sql",
  "visibleSchemaPath": "schema.sql",
  "permissions": ["select"],
  "resetScriptPath": "reset.sql",
  "statementPath": "statement.md",
  "expectedResult": {
    "ordered": true,
    "columns": ["OrderId", "CustomerName", "Total"],
    "numericTolerance": 0.01
  },
  "timeoutSeconds": 5,
  "maxRows": 20,
  "effectAssertions": [
    "Les quatre commandes et les trois clients restent inchangés après exécution"
  ],
  "solutionPath": "solution.md",
  "reviewCards": [
      "card-sql-orders-join-001-rule",
      "card-sql-orders-join-001-edge"
  ],
  "license": "CC-BY-4.0"
}
